Title,Ques,Ans
Abortion of physically deformed foetus,Question Is it permissible to abort the foetus after medical tests have shown that it is physically deformed?,"Praise be to Allah.There are many causes of deformity of the foetus, many of which could be avoided; one could protect oneself from them or reduce their effects. Islam and medicine both urge people to avoid the causes of disease and to protect themselves against it as much as possible. The teachings of Islam urge us to protect our health and to protect the foetus from many diseases which are caused by ignoring the teachings of Islam and falling into sin such as zinaa (unlawful sexual relationships), drinking alcohol, smoking, and taking drugs. Modern medicine also warns mothers of the imminent danger of taking some medications, or being exposed to x-rays or gamma rays, especially in the early days of pregnancy. If it is proven in a definitive fashion, beyond any doubt, by a trustworthy medical committee, that the foetus is deformed, and that this deformity cannot be treated by the specialists, then in my view it is permissible to abort it, in view of the difficulties it would face in life and the hardship this would present to the parents, and the burdens and responsibilities of care it would place on the society. These considerations and others prompted the Islamic Fiqh Committee of the Muslim World League in its 12th conference held in Makkah on 15 Rajab 1410 AH (10/2/1990 CE), to issue the statement that “it is permissible to abort a foetus which is deformed in the manner mentioned above, with the consent of the parents and within the first 120 days from the beginning of the pregnancy.” The decision of the committee was in accordance with the fatwa of the Standing Committee for Academic Research and Issuing Fatwas in the Kingdom of Saudi Arabia, no. 2484, issued on 16/7/1399 AH. But if the soul has been breathed into the foetus and it has completed 120 days, then it is not permissible to abort it, no matter what the deformity, unless continuation of the pregnancy would put the mother’s life in danger. This is because after the soul has been breathed into the foetus, it is considered to be a person who must be protected, regardless of whether it is free of disease or not, and regardless of whether there is hope of recovery or not. That is because Allaah has a reason for everything that He creates, which many people do not know, and He knows best what is right for His creation, as Allaah says (interpretation of the meaning): “Should not He Who has created know? And He is the Most Kind and Courteous (to His slaves), All Aware (of everything). [al-Mulk 67:14] In the birth of these deformed children there is a lesson for those who are of sound health, and it teaches us of the power of Allaah Who shows His creation the manifestations of His might and the wonders that He has created. Killing and aborting them is a purely materialistic view which pays no attention to matters of religion and morals. Perhaps the existence of these deformities will make people more humble and submissive towards their Lord, and make them bear them with patience, seeking a great reward from Him. Physical deformity is something that Allaah has decreed for some of His slaves. Whoever bears that with patience will attain victory. This is something that happens and has always happened throughout history, but unfortunately studies indicate that the rate of physical deformity is increasing, as the result of pollution of the environment and the increase of harmful rays in the atmosphere, which was previously unknown. It is by the mercy of Allaah that many deformed foetuses are miscarried or die before they are born. The Muslim woman and the Muslim family must bear with patience whatever happens to them, and seek the reward for that with Allaah. And Allaah knows best."
"The hadeeth “O ‘Ali, do not sleep until you do five things” is not saheeh","Question The Prophet (peace and blessings be upon him)) said: “Oh Ali!, do not sleep before you do five things: 1- reading the entire Holy Quran, 2-giving 4000 dirham in charity, 3- visiting the holy Ka’aba, 4- preserving your place in paradise 5- reconciling the enemies. Then Ali, May Allah be pleased with him, said: “Oh Allah’s Apostle! How shall I do this?” the Prophet (peace and blessings be upon him) said: “Do not you know that 1- if you read Surat “Qul Huwa-allahu Ahad” three times, you will be rewarded as if you read the entire Quran. 2- If you read Surat (Al-Fatiha) four times, you will be rewarded as if you gave 4000 dirham in charity. 3- if you say: “There is None has the right to be worshipped except Allah, alone without associate, to Him belongs sovereignty and praise, He gives life and causes death and He is over all things wholly capable” ten times, you will be rewarded as if you visited the holy Ka’aba. 4- if you say: “there is no power nor might except with Allah, The Most High, The Supreme” ten times, you will be considered as if preserved your place in paradise. 5- if you say: “I seek the forgiveness of Allah who none has the right to be worshipped but Him, the Ever-lasting, the Self-subsisting and supporter of all, and I repent to Him” ten times, you will be rewarded as if you reconciled the enemies”. I have heard that this Hadeeth is incorrect, and I believe it is correct; I seek your guidance regarding this Hadeeth. May Allah reward you!.","Praise be to Allah.Praise be to Allah. It says in Majmoo’ Fataawa Ibn Baaz (26/328-330): A pamphlet which includes false ahaadeeth: the Lord of the Worlds, and blessings and peace be upon our Prophet Muhammad and all his family and companions. This was answered by the Shaykh on 25/1/1414 AH: I have studied a pamphlet which says: “The Messenger of Allaah (peace and blessings of Allaah be upon him) said: ‘O ‘Ali, do not sleep until you have done five things: reciting the entire Qur’aan, giving four thousand dirhams in charity, visiting the Ka’bah, safeguarding your place in Paradise and reconciling with your opponent.’ ‘Ali said: How can I do that, O Messenger of Allaah? The Messenger of Allaah (peace and blessings of Allaah be upon him) said: ‘Do you not know that if you recite Soorat al-Ikhlaas –Qul Huwa Allaahu Ahad – three times you have recited the entire Qur’aan? And if you recite al-Faatihah four times you have given four thousand dirhams in charity; and if you say There is no god except Allaah alone with no partner or associate; to Him be dominion and praise, He gives life and causes death, and He is Able to do all things, ten times, you have visited the Ka’bah; and if you say There is no strength and no power except with Allaah, the Most High, the Almighty, ten times, you have safeguarded your place in Paradise; and if you say I seek forgiveness from Allaah, besides Whom there is no other god, the Ever-Living, the Eternal), ten times you have reconciled with your opponent.’ What this pamphlet contains was not narrated in any of the reliable books of hadeeth, rather it is a mawdoo’ (fabricated) hadeeth which was falsely attributed to the Messenger (peace and blessings of Allaah be upon him). Hence I warn my Muslim brothers against being deceived by this hadeeth and other fabricated reports, or printing and distributing them among the Muslims, because that is misguiding the common folk and confusing them, and telling lies about the Messenger of Allaah (peace and blessings of Allaah be upon him), who issued a stern warning to the one who does that deliberately, as he (peace and blessings of Allaah be upon him) said in the saheeh hadeeth: “Telling lies about me is not like telling lies about anyone else. Whoever tells a lie about me deliberately, let him take his place in Hell.” Saheeh al-Bukhaari (1229); Introduction to Saheeh Muslim (4). And he said: “Whoever narrates a hadeeth from me thinking that it is false is a liar.” Introduction to Saheeh Muslim (1). In the saheeh reports narrated from the Messenger (peace and blessings of Allaah be upon him) and compiled in the reliable books of Saheeh, Sunan and Musnads there is sufficient information and the one whom Allaah guides to goodness has no need to turn to the reports of liars and fabricators. I ask Allaah to bless us all with beneficial knowledge and to enable us to do good deeds and to avoid all the paths of misguidance and deviance, for He is All-Hearing and Ever Near. And peace be upon you and the mercy of Allaah and His Blessings. Grand Mufti of the Kingdom of Saudi Arabia, Head of the Council of Senior Scholars and the Council for Academic Research and Issuing Fatwas. This hadeeth has also been dealt with in the answer to question no. 30765 in which Shaykh Ibn ‘Uthaymeen and the Standing Committee are quoted as saying that this hadeeth is da’eef (weak). And Allaah knows best."
Benefits of the Internet in spreading knowledge,"Question Assalammualaikum I would like to know, from your point of view, does the Internet bring any benefits to the Islamic society in terms of spreading information to the user??? Thank You.","Praise be to Allah.All Praises Are Due to Allah. The answer to your question is in what you see and not in what you hear. I don't think the issue needs to be addressed; however, your question must be regarding the negative and unlawful things found on the Internet, and not the positive aspects as they are clearly evident. There are in fact many down sides in the Internet, which contain great evil and this is what pushes one to think of the necessary ways to fix the ills on the Internet. It is the obligation of the experts from amongst the Muslims to work on this issue."
Types of turning away in prayer,Question I want to know whether turning away in prayer is an innovation (bid‘ah) or does it invalidate the prayer?,"Praise be to Allah.Turning away in prayer is of different types: 1. Turning away physically, by turning one’s chest away from the direction of the qiblah. This type of turning away invalidates the prayer, because facing towards the qiblah is one of the conditions of prayer being valid. For more information, please see the answer to question no. 65853 . 2. Turning away one’s head or eyes only, whilst the body remains facing towards the qiblah. This type of turning away is disliked (makrooh), unless the Muslim does it because he needs to. If he does it with no need, then he has undermined the reward for his prayer but it is still valid and is not rendered invalid by that. It says in al-Mawsoo‘ah al-Fiqhiyyah (27/109): There is no difference of opinion among the fuqaha’ regarding the fact that it is disliked (makrooh) to turn away in prayer, because of the hadith of ‘Aa’ishah (may Allah be pleased with her), who said: I asked the Prophet (blessings and peace of Allah be upon him) about turning away in prayer and he said: “It is something that the Shaytaan steals from a person’s prayer.” Narrated by al-Bukhaari (751). It is only disliked (makrooh) if it is done unnecessarily or without an excuse. But if there is a need for that, such as if the worshipper fears for himself or his property, then it is not disliked. End quote. It says in Fataawa al-Lajnah ad-Daa’imah (7/27): Turning away in prayer is disliked and undermines its reward, but the one who turns away in prayer is not obliged to repeat his prayer, because in other hadiths there is evidence which indicates that it is permissible to turn away if there is a need to do so. Thus it is known that it does not invalidate the prayer. End quote. There are many hadiths which indicate that it is permissible to turn away in prayer if that is done for a reason, such as the report narrated by Muslim (431) from Jaabir (may Allah be pleased with him), who said: The Messenger of Allah (blessings and peace of Allah be upon him) was sick, so we prayed behind him when he was sitting, and Abu Bakr made the people hear the takbeer. He turned to look at us and saw that we were standing, so he gestured to us that we should sit down, and we prayed behind him sitting. Abu Dawood (916) narrated that Sahl ibn al-Hanzaliyyah (may Allah be pleased with him) said: The iqaamah for prayer – meaning Fajr prayer – was given, and the Messenger of Allah (blessings and peace of Allah be upon him) began to pray whilst he kept turning and glancing up at the mountain pass.” Abu Dawood said: He had sent a rider to the mountain pass to stand guard overnight. Classed as saheeh by all-Albaani in Saheeh Abi Dawood. Shaykh Ibn Baaz (may Allah have mercy on him) said: There is nothing wrong with turning away whilst praying to seek refuge with Allah from the accursed Shaytaan when experiencing intrusive thoughts (waswasah); rather it is recommended (mustahabb) when there is an urgent need for it, but it should be done with the head only."" (Majmoo‘ Fataawa Ibn Baaz 11/130). 3. There is another type of turning away, which is turning away whilst praying in one’s heart, through thoughts that distract a person so that he does not focus and reflect on his prayer. Shaykh Ibn ‘Uthaymeen (may Allah have mercy on him) said: You should understand that turning away is of two types: 1. Turning away in a physical sense, which is turning the head; 2. Turning away in a metaphorical sense, in the heart. This refers to waswaas and passing thought that come to the heart. This is a problem that no one is free of; how difficult it is to treat it and how few are those who are safe from it. It undermines the prayer, and would that it was only in part of the prayer. But a person may turn away from the beginning of his prayer until the end, and it may truly be said that this is somethings that the Shaytaan steals from a person’s prayer."" (Ash-Sharh al-Mumti‘ 3/70). And Allah knows best."
"He borrowed money and the person to whom it was owed has died, and he does not know how to repay it","Question My husband’s father borrowed an amount of money before 1948, but he did not have enough money to pay it back, and the person whose money it was died. Then disaster befell Palestine and we were expelled from there. His financial position remained bad, then my husband’s father died, and my husband’s and my financial position was not good. Now my husband and I want to pay off this debt, knowing that we have been living in Saudi since 1967 and I do not know anything about the heirs of the man who lent the money. My husband has a brother who is out of work and has a family and handicapped children; his eyesight is very poor and he cannot work. So should we give this money to my husband’s brother with the intention of repaying this debt on behalf of the person who has died, and the charity will be on behalf of the one to whom that money belongs? Please advise me, may Allaah reward you with all good.","Praise be to Allah. You have to look for the heirs of the person to whom this money belongs, trying all ways and means to find them and not be negligent in this matter, then you should give the money to them. If you are not able to do that, then give the money in charity with the intention that the reward should go to him (the owner), giving it in any charitable cause that will help to meet the needs of the Muslims. Our advice is not to give it to your husband’s brother, because that may be seen as favouritism, and lest he be accused of that and people slander his honour because of that."
Prohibition on describing the charms of another woman to one’s husband,Question Is there any hadeeth narrated from the Prophet (peace and blessings of Allaah be upon him) which forbids a wife to tell her husband of the charms of another woman?.,"Praise be to Allah.Yes, that was narrated from the Prophet (peace and blessings of Allaah be upon him). It was narrated that ‘Abd-Allaah ibn Mas’ood (may Allaah be pleased with him) said: The Prophet (peace and blessings of Allaah be upon him) said: “No woman should look at or touch the body of another woman to describe her to her husband.” Narrated by al-Bukhaari, 5240. Al-Haafiz Ibn Hajar said: Al-Qaabisi said: The reason for this prohibition is the fear that the husband may like the description and that may lead him to divorce the woman who gave the description or be tempted by the woman who was described to him. Fath al-Baari, 9/338; ‘Awn al-Ma’bood, 6/132; Fayd al-Qadeer, 9723. And Allaah knows best."
Fasting the Days of Tashriq,"Question I have the habit of fasting every Thursday and it so happened that I fasted on Thursday 12th Dhu’l-Hijjah. On the Friday, I heard that it is not permissible to fast on the Days of al-Tashreeq and that Thursday was the third of the days of al-Tashreeq. Is there any sin on me if I fasted that day? Is it true that it is not permissible to fast on the days of al-Tashreeq or should we avoid fasting only on the first days of Eid?","Praise be to Allah.Can you fast on Eid? Fasting on the two days of Eid is haraam, as indicated by the hadeeth of Abu Sa’eed al-Khudri (may Allah be pleased with him) who said: The Prophet (peace and blessings of Allah be upon him) forbade fasting on the day of al-Fitr and al-Nahr .” (Narrated by al-Bukhaari, 1992; Muslim, 827) The scholars are unanimously agreed that fasting on these two days is haraam. Can you fast on Days of Tashreeq? It is also haraam to fast on the days of al-Tashreeq which are the three days after Eid al-Adha (the 11th, 12th and 13th of Dhu’l-Hijjah). because tThe Prophet (peace and blessings of Allah be upon him) said: “The days of al-Tashreeq are days of eating, drinking and remembering Allah.” (Narrated by Muslim, 1141) Abu Dawood (2418) narrated from Abu Murrah the freed slave of Umm Haani that he entered with ‘Abd-Allah ibn ‘Amr upon his father ‘Amr ibn al-‘Aas. He offered them food and said, “Eat.” He said, “I am fasting.” ‘Amr said: “Eat, for these are the days on which the Messenger of Allah (peace and blessings of Allah be upon him) would tell us not to fast and forbade us to fast, and these are the days of al-Tashreeq .” (Classed as saheeh by al-Albaani in Saheeh Abi Dawood) Can a pilgrim fast the Days of Tashreeq? But it is permissible to fast on the days of al-Tashreeq for a pilgrim who does not have a hadiy (sacrificial animal). It was narrated that ‘Aa’ishah and Ibn ‘Umar (may Allah be pleased with them) said: No one was allowed to fast on the days of al-Tashreeq except one who could not find a hadiy. (Narrated by al-Bukhaari, 1998) Shaykh Ibn ‘Uthaymeen said: “It is permissible for those who are doing Hajj qiraan or tamattu’, if they cannot find a hadiy, to fast these three days so that the Hajj season will not end before they fast. But apart from that it is not permissible to fast on these days, even if a person is obliged to fast for two consecutive months; he should not fast on the day of Eid and the three days following it, but then he should continue his fast.” (Fataawa Ramadaan, p. 727) See also questions no. 21049 and 36950 . And Allah knows best."
"If an eclipse happens at the time of Jumu‘ah prayer, which prayer should be done first?",Question What is the ruling if the time of an eclipse coincides with the time of Jumu‘ah prayer?,"Praise be to Allah. Firstly: If the sun is eclipsed on a Friday, if that occurs before Jumu‘ah at a time when there is sufficient time to do the ordinary eclipse prayer (salaat al-kusoof), such as if the eclipse occurs in the forenoon or close to it, then you should start with the eclipse prayer, then pray Jumu‘ah at the proper time. If the eclipse occurs at the time of Jumu‘ah, if there is the fear that Jumu‘ah prayer may be missed, then Jumu‘ah should be done first, according to scholarly consensus. If there is no risk of it being missed, then the majority of scholars are of the view that the eclipse prayer should be done first. The Hanbalis follow the view that was favoured by Ibn Qudaamah (may Allah have mercy on him), that Jumu‘ah should be done first, because starting with the eclipse prayer may lead to hardship for some people, because it will lead to keeping people back for the sake of praying the eclipse prayer and compelling them to pray it, when it is not obligatory in the first place. Ibn Qudaamah (may Allah have mercy on him) said in al-Mughni (2/146): if two prayers occur at the same time, such as the eclipse prayer with another prayer such as Jumu‘ah or Eid or one of the obligatory prayers or Witr, then people should start with the one which they are more afraid of missing. If there is the fear that they may miss both, then they should start with the obligatory prayer. If neither of them is obligatory, such as the eclipse prayer and Witr or Taraweeh, then they should start with the one which is more emphasised. For example, in the case of the eclipse prayer and Witr, they should start with the eclipse prayer, because it is more emphasised, and for that reason it is Sunnah to offer it in congregation; moreover, Witr may be made up later on but the eclipse prayer cannot be made up later on. If Taraweeh and the eclipse prayer coincide, then which of them should be done first? There are two points of view concerning this. The view of our companions, and the correct view in my opinion, is that the obligatory prayer that is offered in congregation takes precedence over the eclipse prayer in all situations, because giving precedence to the eclipse prayer over it will cause hardship and will require the people present to offer the eclipse prayer even though it is not obligatory upon them, and will force them to wait for the obligatory prayer, even though among them there may be those who are physically weak, elderly or have needs to attend to. The Prophet (blessings and peace of Allah be upon him) instructed us to make the obligatory prayer brief, so that it would not cause undue hardship to those who are praying in congregation behind the imam. Hence it is more appropriate to say that we should not cause hardship by offering this lengthy and difficult prayer, even though it is not obligatory. The same ruling applies if it coincides with Taraweeh prayer; Taraweeh should be given precedence for the same reason. If the eclipse prayer coincides with Witr at the beginning of the time for Witr, it should be given precedence, because Witr will not be missed; if there is the fear that Witr will be missed, precedence should be given to Witr, because it is brief and can be done easily, and one can still catch up with the time of the eclipse prayer. If there is no time left except as much is needed to do Witr, then there is no need to undertake the eclipse prayer, because it has occurred at a time when prayer is not allowed. If the eclipse coincides with the time of a funeral prayer, the funeral prayer should be given precedence according to scholarly consensus, because there is concern for the deceased. And Allah knows best. End quote. An-Nawawi (may Allah have mercy on him) said in al-Majmoo‘ (5/61): ash-Shaafa‘i and his companions (may Allah have mercy on them) said: When two prayers coincide, precedence should be given to the one that it is feared may be missed, then that which is most emphasised. If Eid and the eclipse prayer coincide, or Jumu‘ah and the eclipse prayer, and there is the fear that the Eid prayer or Jumu‘ah prayer may be missed because there is not enough time, then precedence should be given to the Eid or Jumu‘ah prayer, because they are more emphasised than the eclipse prayer. If there is no fear of missing them, then the more correct view, which was stated categorically by the author [Abu Ishaaq ash-Shiraazi] and the majority, is that precedence should be given to the eclipse prayer, because there is the fear that it may be missed. End quote. See also: al-Mawsoo‘ah al-Foqhiyyah (27/258) What appears to be more correct is the view of Ibn Qudaamah (may Allah have mercy on him), because of what he mentioned about difficulty and hardship, and because Jumu‘ah is more emphasised and more important. Shaykh Ibn ‘Uthaymeen (may Allah have mercy on him) was asked: If two prayers coincide, the eclipse prayer and another prayer, such as an obligatory prayer, or Jumu‘ah prayer, or Witr, or Taraweeh, which should be given precedence? He replied: The obligatory prayer should be given precedence over the eclipse prayer (for solar or lunar eclipse), because it is more important, and because Allah, may He be exalted, said in the hadith qudsi: “My slave does not draw close to Me by means of anything more beloved to Me than that which I have made obligatory for him.” End quote from Majmoo‘ Fataawa Ibn ‘Uthaymeen (16/307) Secondly: If the imam begins with Jumu‘ah, he should deliver the khutbah then lead the Jumu‘ah prayer, then he should offer the eclipse prayer and deliver a khutbah for that. If he starts with the eclipse prayer and completes it, he should deliver a khutbah for Jumu‘ah and mention the eclipse in it, then pray Jumu‘ah, and the two Jumu‘ah khutbahs will suffice for the khutbah that is usually given with the eclipse prayer. An-Nawawi (may Allah have mercy on him) said, in the book quoted from above: If Jumu‘ah and an eclipse coincide, and the situation requires giving precedence to Jumu‘ah, he should deliver the khutbah for it then pray Jumu‘ah, then offer the eclipse prayer, then give a khutbah for the eclipse. If the situation requires giving precedence to the eclipse prayer, he should start with it, then give the khutbah for Jumu‘ah, making mention of the eclipse in it and what is recommended in this situation in the two Jumu‘ah khutbahs, and there is no need for four khutbahs. Our companions said: This refers to the two Jumu‘ah khutbahs only. This was also stated by ash-Shaafa‘i in al-Umm. End quote. And Allah knows best."
