Title,Ques,Ans
What is the ruling if the two witnesses did not hear the woman giving her consent to the marriage?,"Question I entered Islam, and when I gave my consent to my wali (guardian) to represent me in my marriage contract, that was by telephone, and in front of two witnesses who were men, but they did not hear the conversation. Is this marriage valid? Because my husband and I have had intercourse, believing that the marriage was valid. If it is not, then is it permissible for me to repeat the marriage contract with him?","Praise be to Allah. In order for the marriage to be valid, it is stipulated that the marriage contract should be done by the woman’s guardian, and that it should be witnessed by two Muslim male witnesses, because the Prophet (blessings and peace of Allah be upon him) said: “There is no marriage except with a guardian.” Narrated by Abu Dawood (2085), at-Tirmidhi (1101) and Ibn Maajah (1881), from the hadith of Abu Moosa al-Ash‘ari; classed as saheeh by al-Albaani in Saheeh at-Tirmidhi. And he (blessings and peace of Allah be upon him) said: “There is no marriage except with a guardian and two witnesses of good character.” Narrated by al-Bayhaqi from the hadith of ‘Imraan and ‘Aa’ishah; classed as saheeh by al-Albaani in Saheeh al-Jaami‘, no. 7557. The woman’s guardian is her father, then her father’s father, then her son (if she has one), then her full brother, then her brother through her father, then the son of her full brother, then the son of her brother through her father, then her paternal uncle, then his son, then the Muslim ruler. Al-Mughni (9/355) If the woman is a Muslim, it is stipulated that her guardians should also be Muslim. Ibn Qudaamah (may Allah have mercy on him) said: With regard to a disbeliever, he has no guardianship over a Muslim woman under any circumstances, according to the consensus of the scholars, including Maalik, ash-Shaafa‘i, Abu ‘Ubayd and as-haab ar-ra’y. Ibn al-Mundhir said: Those scholars from whom we acquired knowledge unanimously agreed on this point. End quote from al-Mughni (9/377) Based on that, if your guardian is a Muslim, then the condition of having a guardian was fulfilled. But if he was not Muslim, then the marriage contract is not valid, and must be repeated at the hands of your Muslim guardian, if you have one. If you do not have one, then the Muslim judge must do your marriage contract, if there is a Muslim judge; otherwise it may be done by the director of the Islamic centre or someone of similar standing among the Muslims. If no such person is available, then a Muslim man of good character may do your marriage contract. With regard to witnesses, what is meant is that the marriage contract must be witnessed by two Muslim witnesses who are present at the marriage contract that is done between the guardian and the suitor. Everyone who is present at the marriage contract, such as a scribe, relative, official and so on is a witness to it, if he is fit to be a witness, i.e., he is a Muslim of good character. Many of the scholars are of the view that if the marriage is publicised widely and announced, there is no need for there to be witnesses, because of the report narrated by Ahmad from ‘Abdullah ibn az-Zubayr (may Allah be pleased with him), according to which the Prophet (blessings and peace of Allah be upon him) said: “Publicise the marriage.” This hadith was classed as hasan by al-Albaani in Irwa’ al-Ghaleel no. 1993. Shaykh al-Islam Ibn Taymiyah (may Allah have mercy on him) said: Undoubtedly marriage that is publicised widely is valid, even if it is not witnessed by two witnesses. But if it is done in secret and with witnesses, this is something that is subject to further discussion. If it is both witnessed and widely publicised, then there is no dispute that it is valid. If there are no witnesses and it is not widely publicised, then it is invalid according to the majority of scholars, and if there is any differing opinion it is insignificant. End quote from al-Ikhtiyaaraat al-Fiqhiyyah, p. 177 See also the answers to questions no. 124678 and 112112 Based on that, if these two witnesses witnessed the marriage contract, or the marriage was widely publicised and announced, then your marriage is valid; if that was not the case, then you must do a new marriage contract. And Allah knows best."
Ruling on voting in contests and competitions for someone about whom one knows nothing,"Question What is the ruling on voting for someone in a scientific field when I do not know him, and I do not know anything about his work for which I am voting for him, such as voting for some achievement such as research, or a knowledge challenge in education at the national level, when they say vote for this or that student?","Praise be to Allah.Voting for someone is a kind of testimony and praise, so the vote should be based on truth, which can only be based on knowing the person and the field in which he is competing, and whether he deserves to be given precedence over someone else. As for voting for someone whom you do not know, and you do not know anything about his work, let alone whether he deserves to be promoted, that is not permissible; it is a betrayal of trust, giving false testimony, and deceiving the organization that is asking people to vote. In most cases the motivation for doing that is a kind of tribal feeling for a country or race. All of that is blameworthy and leads to giving promotion to those who do not deserve it. Al-Bukhaari (5976) and Muslim (87) narrated that Abu Bakrah (may Allah be pleased with him) said: The Messenger of Allah (blessings and peace of Allah be upon him) said: “Shall I not tell you of the worst of major sins?” We said: Yes, O Messenger of Allah. He said: “Associating others with Allah, defiantly disobeying one’s parents –” he was lying down, but he sat up and said: “and false speech and bearing false witness, and false speech and bearing false witness” – and he kept on saying it until I thought that he never fall silent. [This was out of compassion, for fear that he would exhaust himself in his fervour]. And the Prophet (blessings and peace of Allah be upon him) said: “Whoever deceives us is not one of us.” Narrated by Muslim in his Saheeh, no. 101. Shaykh ‘Abd ar-Rahmaan al-Barraak (may Allah preserve him) was asked: Some sisters send messages asking us to vote for their relatives who are taking part in a competition for work. They ask us to vote, when we have not seen his work and are not present at the competition. He replied: No, it is wrong. If you vote for him and support him, and say such and such, then you are speaking untruthfully, and you are lying. End quote from the shaykh’s website. And Allah knows best."
She is sad because she is unmarried and is asking for advice,"Question Sheikh, I am 29 years old, I have not married yet. I always ask Allah to bless me with a righteous husband who helps me religiously and in life. I am sure that Allah will answer my prayer soon. I know all the preferable times of making dua. My problem is that I feel that every act worship I do is being done for the sake of answering my prayer. I fast because the dua of a fasting person will be answered, I pray late at night because making dua while praying late at night is accepted, I pray the sunan so that I become closer to Allah that He accepts my dua. In brief; I feel that all my worship is not purely for the sake of Allah, and this feeling suffocates me. What shall I do? Another thing is I am very tired because of remaining unmarried, I keep asking Allah knowing that He is the most generous, most bounteous, but I fear my sins, I fear my dua is not being answered because of my sins, what shall I do? Please sheikh, advise me and make dua for me. Please, please, ask Allah to bless me with a righteous husband, better than I deserve. May Allah reward you and bless you with the highest paradise.","Praise be to Allah. Allaah, may He be blessed and exalted, says (interpretation of the meaning): “it may be that you dislike a thing and Allaah brings through it a great deal of good” [al-Nisa’ 4:19] “and it may be that you dislike a thing which is good for you and that you like a thing which is bad for you. Allaah knows but you do not know” [al-Baqarah 2:216]. It was narrated that Ibn ‘Abbaas said: I was riding behind the Messenger of Allaah (peace and blessings of Allaah be upon him) one day and he said: “O boy, I shall teach you some words. Be mindful Allaah and He will take care of you. Be mindful of Allaah and He will protect you. If you ask then ask of Allaah, and if you seek help then seek help from Allaah. Know that if the nation were to gather together to benefit you in some way, they would not benefit you except in something that Allaah has decreed for you, and if they were to gather together to harm you in some way, they would not harm you except in something that Allaah has decreed for you. The pens have been lifted and the pages have dried.” Narrated by al-Tirmidhi (2516). You should note that what you have to do is to be content with your situation and realize that what Allaah has chosen for you is the best, and you missing out on something may be a good thing. Do not let the whispers of the accursed shaytaan affect you and lead you every which way. Rather you should be as our Lord likes you to be, and accept His decree and thank Him for His blessings. Ponder the blessings that Allaah has bestowed upon you, and do not worry. Keep yourself busy with worship of Allaah and make a program for yourself so that you can wake up for Fajr prayer and then read Qur’aan and adkhaar and du’aas. Attend lectures and reminders and Islamic conferences. Through this program you will be able to relax and find peace of mind. Always comfort yourself with the words of the Messenger of Allaah (peace and blessings of Allaah be upon him) “How wonderful is the situation of the believer, for all his affairs are good. If something good happens to him, he gives thanks for it and that is good for him; if something bad happens to him, he bears it with patience, and that is good for him. This does not apply to anyone but the believer.” Narrated by Muslim (2999). Be kind to yourself, and remember that there are millions of women like you who are not married, but many of them may be happier than many of those who are married. May Allaah open your heart to contentment with His decree and give you peace of mind about your situation, and fill your heart with happiness. You are better off than many others! Does your sorrow at not being married increase when you see a woman and her husband and children going on a trip? Does this remind you that you are alone and without a husband and children? Does it make you feel that you have been wronged, or that you are unfortunate, or that you are deprived? Wait a minute, do not let these negative feelings and frustrations prevail over you and increase your sense of sadness and sorrow. You have seen only one aspect of this family’s life, but there are many other aspects that you have not seen. Perhaps if you saw the wife who has a hard-hearted husband who shows no compassion, and you heard her complaints about her continual suffering with him, you would praise Allaah for saving you from marriage. If you sit with a divorced woman who laments her fate and says that she regrets having married, and you listen to her as she complains about how much she put up with and how much she suffered until she got her divorce, and regained her sense of security, perhaps you will praise Allaah for not having got married and suffered what she has suffered. If you think about what thousands of wives are suffering and what may others whose marriages ended in divorce have had to put up with, this will reduce many of the feelings of regret that you have because of not being married. This way of thinking will dispel your feeling of having been hard done by, and will replace those feelings with a beautiful sense of contentment, which will earn you the pleasure of Allaah, as I told you in the previous message. Remember your friend’s complaints about her husband yelling and being angry all the time, and how you have been saved from that. Remember your neighbour who left her home weeping after her husband beat her and hurt her. “I have reached my forties and am not married, and I praise Allaah for everything that He has decreed for me. At first I felt sad and upset whenever I was alone, and I regretted my misfortune every time one of my friends got married. I did not have any conditions or specific characteristics in the man I wanted to marry; I was prepared to accept any righteous man. But years went by without this man coming to me. I began to withdraw from people so that I would not see their looks of pity but I could not escape them completely, because I would see them in the eyes of my parents and siblings who would pray for me every time they saw me. One day at the end of Sha’baan, as we were preparing for the blessed month of Ramadaan, Allaah guided me to keep a Mus-haf just for myself. I decided to read the whole Qur’aan and I found it very difficult to read it because I had stopped reading for the last ten years. I also found it difficult to understand some verses, so I bought a book of Tafseer (commentary) and I started to read it so that I could understand the verses of Qur'aan that I was reading. Ramadaan ended but my attachment to the Book of Allaah did not stop; I carried on reading the verses of Allaah and reading the commentary thereon. “Then came the day when I read the verse in Soorat al-Kahf (interpretation of the meaning): Wealth and children are the adornment of the life of this world. But the good righteous deedsthat last, are better with your Lord for rewards and better in respect of hope [al-Kahf 18:46]. I wondered, what does the good righteous deedsthat last’ mean? I found in the Tafseer that it refers to all righteous deeds. “I fell in love with righteous deeds such as prayer, fasting, charity, tasbeeh, tahmeed, tahleel and takbeer. Happiness began to fill my heart and I became content. I praised Allaah greatly for guiding me to this path and teaching me these things.” Sister Umm Yamaan adds: “But this is not a call for monasticism, rather it is a call to accept the will and decree of Allaah.” Ghayr Mutazawwajaat walakin Sa’eedaat (Unmarried but Happy) 1/4-7 by Muhammad Rasheed al-‘Uwayd. But every girl should understand that the purpose of life is to be a true slave of Allaah in both the specific and general senses. If she has the opportunity to establish a Muslim household, then the girl will be worshipping Allaah by getting married and raising children, and raising for us the generation that we want. But if that does not happen, then the ways of worshipping Allaah in general are many, foremost among which is calling people to Allaah. So she should focus on women who have deviated from the path of Allaah and take them as her daughters and guide them to the straight path of Allaah. “The one who calls people to guidance will have a reward equal to theirs, without it detracting from their reward in the slightest.” So regard the Muslim community as your home, and be like a beacon of guidance, truth, justice and knowledge, and let us advise one another to adhere to truth and patience. “Surely, Allaah wastes not the reward of the Muhsinoon [those who do good]” [al-Tawbah 9:120]. Ghayr Mutazawwajaat walakin Sa’eedaat (Unmarried but Happy) 1/12 by Muhammad Rasheed al-‘Uwayd. See also the answer to questions no. 21234 and 72257. And Allaah knows best."
How did the Sahaabah turn around during their prayer when news reached them that the qiblah had been changed?,"Question I am a little confused, because when I was in Madinah, I visited Masjid al-Qiblatayn. There was a brother who explained to us how the Sahaabah turned around when news reached them that the qiblah had been changed, and he showed us how the imam turned around, and said that he cut through the rows of worshippers, and they also turned around. My question is: after the imam changed his qiblah and turned around, what did the women at the back do? Did they also turn around, or did they interrupt their prayer, or did they stay as they were? Is there any proven, saheeh story in the first place about the way in which the qiblah was changed?","Praise be to Allah.Firstly: The story of the change of the qiblah from Bayt al-Maqdis (Jerusalem) to al-Masjid al-Haraam (Makkah) is proven in the Qur’an, and is also proven in some detail in the Prophet’s Sunnah. Allah, may He be exalted, says (interpretation of the meaning): “The fools (pagans, hypocrites, and Jews) among the people will say, ‘What has turned them (Muslims) from their Qiblah (prayer direction (towards Jerusalem)) to which they were used to face in prayer?’ Say, (O Muhammad SAW) ‘To Allah belong both, east and the west. He guides whom He wills to a Straight Way.’ Thus We have made you (true Muslims - real believers of Islamic Monotheism, true followers of Prophet Muhammad SAW and his Sunnah (legal ways)), a Wasat (just) (and the best) nation, that you be witnesses over mankind and the Messenger (Muhammad SAW) be a witness over you. And We made the Qiblah (prayer direction towards Jerusalem) which you used to face, only to test those who followed the Messenger (Muhammad SAW) from those who would turn on their heels (i.e., disobey the Messenger). Indeed it was great (heavy) except for those whom Allah guided. And Allah would never make your faith (prayers) to be lost (i.e., your prayers offered towards Jerusalem). Truly, Allah is full of kindness, the Most Merciful towards mankind. Verily! We have seen the turning of your (Muhammad’s SAW) face towards the heaven. Surely, We shall turn you to a Qiblah (prayer direction) that shall please you, so turn your face in the direction of Al-Masjid- al-Haram (at Makkah). And wheresoever you people are, turn your faces (in prayer) in that direction. Certainly, the people who were given the Scriptures (i.e., Jews and the Christians) know well that, that (your turning towards the direction of the Ka‘bah at Makkah in prayers) is the truth from their Lord. And Allah is not unaware of what they do.” [al-Baqarah 2:142-144]. Al-Bukhaari (41) narrated from al-Bara’ ibn ‘Aazib that when the Prophet (blessings and peace of Allah be upon him) first came to Madinah, he stayed with his grandfathers or his maternal uncles among the Ansaar, and he prayed facing towards Bayt al-Maqdis for sixteen or seventeen months. But he wanted his qiblah to be towards the Ka‘bah. The first prayer he offered (after the qiblah was changed) was ‘Asr prayer, and some people prayed with him. Then one of the men who had prayed with him went out and passed by some people who were praying in a mosque, and they were bowing. He said: I bear witness by Allah that I (just) prayed with the Messenger of Allah (blessings and peace of Allah be upon him) facing towards Makkah. And they turned around, as they were, to face towards the Ka‘bah. The Jews and the People of the Book used to like it when he prayed facing towards Bayt al-Maqdis, and when he turned to face towards the Ka‘bah, they did not like that. Muslim (527) narrated from Anas that the Messenger of Allaah (blessings and peace of Allah be upon him) used to pray towards Bayt al-Maqdis, then it was revealed: “Verily, We have seen the turning of your (Muhammad’s) face towards the heaven. Surely, We shall turn you to a Qiblah (prayer direction) that shall please you, so turn your face in the direction of Al-Masjid Al-Haraam (at Makkah)” [al-Baqarah 2:144]. A man passed by Banu Salamah whilst they were bowing in Fajr prayer, and they had prayed one rak'ah. He called out: The qiblah has been changed, and they turned as they were towards the qiblah. Muslim also narrated (526) that Ibn ‘Umar said: Whilst the people were praying Fajr in Quba’, someone came to them and said: Revelation came to the Messenger of Allah (blessings and peace of Allah be upon him) last night and he was commanded to face towards the Ka‘bah, so face towards it. They were facing towards Syria, so they turned to face the Ka‘bah. Secondly: With regard to the manner in which the Sahaabah (may Allah be pleased with them) turned around whilst they were praying when news reached them that the qiblah had been changed, it was as follows: The imam turned around, and those who were with him shifted from their places in a half circle, so that the imam shifted the back of the mosque, on the side closest to the Ka‘bah, and the men ended up behind him, and the women ended up where the men had been originally. The word translated as turned around in the hadeeths quoted above does not mean that the imam cut through the rows; rather it may be understood that what happened was simply that he shifted. Al-Haafiz Ibn Hajar (may Allah have mercy on him) said: An explanation of how they turned around is given in the hadeeth of Thuwaylah bint Aslam, which was narrated by Ibn Abi Haatim, and I said something similar. She said: The women moved to the men’s place, and the men moved to the women’s place, and we prayed the last two rak‘ahs facing towards the Sacred House (the Ka‘bah). I say: To give a vivid image of what happened, the imam shifted from his place at the front of the mosque to the back of the mosque, because the one who faces towards the Ka‘bah [in Madinah] will have Bayt al-Maqdis at his back. If he had turned around on the spot, there would not have been enough room behind him for the rows of worshippers. When the imam shifted, the men also shifted until they were behind him, and the women shifted until they were behind the men. This requires a great deal of movement in the prayer; it is possible that this happened before the prohibition on moving a great deal in the prayer, and it probably also happened before the prohibition on talking during the prayer. Or it may be understood as meaning that the actions mentioned were overlooked because of the great significance of the matter in question. Or it may be that when they shifted, they did not move all in one go; rather it was a gradual shifting. And Allah knows best. End quote from Fath al-Baari, 1/506-507 See also: Tafseer Ibn Katheer, 1/167, 470 Thirdly: Visiting the “seven places” (or the “seven mosques”) in Madinah with the intention of worship and attaining reward is not prescribed in Islam. Shaykh ‘Abd al-‘Azeez ibn Baaz (may Allah have mercy on him) said: With regard to the seven mosques, Masjid al-Qiblatayn, and other places that are mentioned by some writers as places to be visited as part of the rituals, there is no basis or evidence for that. What is prescribed for the believer at all times is to follow and not innovate. End quote from Majmoo‘ Fataawa Ibn Baaz, 6/321 For more information, please see the answer to question no. 11669. And Allah knows best."
He wants to delay making up Ramadan fasts until winter because the days are shorter,"Question What is the ruling on making up missed Ramadan fasts in winter when, as we know, the days are short?.","Praise be to Allah.The one who does not fast some days in Ramadan is obliged to make them up before the next Ramadan comes, whether that is in the winter or otherwise, because Allaah says (interpretation of the meaning): “but if any of you is ill or on a journey, the same number (should be made up) from other days” [al-Baqarah 2:184]. And it is proven that ‘Aa’ishah (may Allah be pleased with her) had days to make up, but she did not make them up until Sha‘baan came because of the status of the Prophet (blessings and peace of Allah be upon him). And Allah is the source of strength. May Allah send blessings and peace upon our Prophet Muhammad and his family and Companions. End quote."
