Title,Ques,Ans
Beware of the Whispers of the Shaytan about Allah,"Question For two weeks this question has been haunting me and I cannot find an answer to it, but in sha Allah you will have the answer: What is the evidence that Allah does not lie, or what is the evidence that He always tells the truth, and why will He never lie? I know that this is a strange question, and I felt too embarrassed to ask anyone about it for a while, but I looked for an answer and I feel a kind of anxiety even when praying.","Praise be to Allah.By Allah, we do not know which of your two issues we find stranger, that you have gone along with the whispers of the shaytan (devil) to such an extent that brought you to the brink of the abyss and nearly made you fall in, or that you find this question difficult and are not able to find an answer to it. What do you know of your religion, if you do not know this? What do you think of your Lord, if you are asking about this? When her freed slave asked her: O my mother, did Muhammad (peace and blessings of Allah be upon him) see his Lord? ‘Aishah, the Mother of the Believers, (may Allah be pleased with her) said: My hair stood on end at what you said. If the hair of the Mother of the Believers stood on end because of alarm for the one who asked her this question: Did Muhammad (peace and blessings of Allah be upon him) see his Lord, i.e., in this world – although the believers will see Him in Paradise and that will be the greatest of their joys (may Allah not deprive us of it) – then how should one react to your question? Have you left your heart empty to such an extent that the shaytan can toy with it and cause it to end up like this? Have you heard of the report narrated by Muslim in his Saheeh from Jabir who said: A man came to the Prophet (peace and blessings of Allah be upon him) and said: O Messenger of Allah, I saw in a dream as if my head was cut off. The Prophet (peace and blessings of Allah be upon him) smiled and said: If the shaytaan toys with one of you in his sleep, he should not tell the people about it.” If a dream such as this is regarded as the shaytan toying with a person, then what would the Prophet’s (peace and blessings of Allah be upon him) response be to one who saw what you have seen in a dream? What would he say if the shaytan toyed with him when he was awake, and not in a dream? It is natural that you should feel ashamed and you should weep for yourself if the shaytan has gained so much power over you. Yes, we understand that the shaytan may toy with a person in such ways, but he should not go along with the ideas instilled by the shaytan and try to discuss it and look for evidence for it. Rather his deeply rooted faith should protect him, for the shaytan is evil and his plot is weak: “… ever feeble indeed is the plot of shaytan (Satan).” [4:76]. It was narrated that Abu Hurayrah (may Allah be pleased with him) said: The Messenger of Allah (peace and blessings of Allah be upon him) said: “The shaytan comes to some of you and says, ‘Who created such and such? Who created such and such?’ – until he says, ‘Who created your Lord?’ If that happens, then let him seek refuge with Allah and stop thinking about that.” What do you think the Prophet’s (peace and blessings of Allah be upon him) answer would be to this “difficult” question posed by the accursed enemy? One should seek refuge with Allah from this waswas (insinuating whisper), and stop thinking about it or getting carried away with it, because the accursed one does not need an answer to this question. He knows that his question is pure fallacy, for it is not befitting that the Creator should have a creator, otherwise He would be another created being. Rather his aim is to stir up doubts until he gains control over one who dies in such a state, if he can. Al-Hafiz Ibn Hajar (may Allah have mercy on him) said in his commentary on the hadeeth (report) quoted above: “‘Who created your Lord?’ If that happens, then let him seek refuge with Allah and stop thinking about that” i.e., let him stop getting carried away with that, and turn to Allah in warding it off; he should realize that he (shaytan) wants to corrupt his religious commitment and his reasoning with these whispers, so he should strive to ward them off by thinking of something else. Al-Khattabi said: The point of this hadeeth is that if the shaytan whispers such thoughts, one should seek refuge with Allah from him and stop debating with the shaytan about it, then this waswas will diminish. There is no end to the shaytan’s whispers, rather every time proof is produced to silence him, he moves on to something else until he finally makes one confused. We seek refuge with Allah from that. … But his saying ‘Who created your Lord?” is contradictory and is a flawed argument, because it is impossible for the Creator to be created. Al-Teebi said: Rather he enjoined seeking refuge with Allah and distracting oneself with something else; he did not tell us to ponder and look for evidence, because the knowledge that Allah does not need a creator is a basic fact that is not open to debate, and because getting carried away in thinking about that will only make a person more confused. If a person is in such a state, he has no option except to turn to Allah and seek His protection. The hadeeth also implies criticism of asking too much about that which does not concern one and that which one has no need to ask about. It is also one of the signs of Prophethood, namely his foretelling something that was going to happen and then it happened. End quote. As the Prophet (peace and blessings of Allah be upon him) enjoined putting an end to such whispers and not indulging in them, then the believer, if he is overwhelmed by any such thing, and if the accursed enemy instills such a thing in his heart, then he will regard this waswas as something serious that has befallen him. It was narrated that Abu Hurayrah (may Allah be pleased with him) said: Some of the companions of the Prophet (peace and blessings of Allah be upon him) came and asked him: We find in ourselves something that is too awful for any of us to speak of it. He said: “Do you really find that?” They said: Yes. He said: “That is clear faith.” [ Muslim] Al-Nawawi (may Allah have mercy on him) said: What this means is: The fact that you think of this waswas as something terrible is a clear sign of faith, for if you dare not utter it and you are so afraid of it and of speaking of it, let alone believing it, this is the sign of one who has achieved perfect faith and who is free of doubt O slave of Allah, the man of dignity who has some standing among people would refrain from lying and would hate lies to be attributed to him. The story of Abu Sufyan with Heraclius concerning this matter is well known, so how about if this noble and dignified man is a believer? For lying is incompatible with faith. How about if one imagines the Messenger of Allah (peace and blessings of Allah be upon him) telling lies when he is the truthful one? This is an idea that would make the skin crawl and the hair stand on end. It seems most likely that there are two reasons why the shaytan has gained control over you: 1- You have turned away from focusing on remembrance (dhikr) of the Most Merciful, studying His verses and what it says in His Book of His most beautiful names and sublime attributes, and acknowledging His greatness, majesty, beauty and perfection that are mentioned in His Book and in the sunnah (teachings) of His Prophet (peace and blessings of Allah be upon him). 2- Perhaps it is a punishment from Allah because of the first reason, which is your keeping company with the devils among men, who have been supported by the devils among the jinn and helped by them against you. Those companions were not necessarily friends of yours who come and go with you, rather that may have been via the internet as idle curiosity may have led you to go to some atheist and anti-religion chat rooms, where one of them stated his specious argument and it settled in your heart and led to the problem that you are now suffering. Allah says (interpretation of the meaning): “And whosoever turns away blindly from the remembrance of the Most Gracious (Allah) (i.e. this Quran and worship of Allah), We appoint for him shaytan (Satan ‑ devil) to be a Qareen (a companion) to him. And verily, they (Satans / devils) hinder them from the path (of Allah), but they think that they are guided aright! Till, when (such a one) comes to Us, he says [to his Qareen (Satan/devil companion)] ‘Would that between me and you were the distance of the two easts (or the east and west) a worst (type of) companion (indeed)! It will profit you not this Day (O you who turn away from Allah’s remembrance and His worship) as you did wrong, (and) that you will be sharers (you and your Qareen) in the punishment.” [43:36] Set your heart straight and turn to your Lord, and acknowledge Him as He has told you in His Book. Turn to His Book and read it and ponder it, and keep your tongue busy with remembrance of Him (dhikr), for that will protect you: “I command you to remember Allah, for the likeness of that is that of a man whose enemy comes after him, until he comes to a strong fortress where he protects himself from him. Similarly, a person cannot protect himself against the shaytan except by remembering Allah.” [Tirmidhi and classed as saheeh/authentic by al-Albani.] And Allah knows best."
Shaving Head in Islam,Question Is t sunnah to shave the head?,"Praise be to Allah.What may be understood from the words of the scholars (may Allaah have mercy on them) is that shaving the head is of six kinds: 1 – An act of worship and a means of drawing closer to Allaah, for which a person will be rewarded. This applies in four cases only, to which there is no fifth: (i)Hajj (ii)‘Umrah. Allaah says (interpretation of the meaning): “Indeed Allaah shall fulfil the true vision which He showed to His Messenger [i.e. the Prophet saw a dream that he has entered Makkah along with his Companions, having their (head) hair shaved and cut short] in very truth. Certainly, you shall enter Al-Masjid Al-Haraam, if Allaah wills, secure, (some) having your heads shaved, and (some) having your head hair cut short” [al-Fath 48:27] (iii)Shaving the child’s head on the seventh day after birth. The evidence for that is the hadeeth narrated by al-Tirmidhi (1439) from ‘Ali ibn Abi Taalib (may Allaah be pleased with him) who said: “The Messenger of Allaah (peace and blessings of Allaah be upon him) offered a sheep as ‘aqeeqah for al-Hasan, and said: ‘O Faatimah, shave his head and give the weight of his hair in silver in charity.’” (Classed as hasan by al-Albaani in Saheeh al-Tirmidhi, 1226. See also Tuhfat al-Mawlood by Ibn al-Qayyim, p. 217). (iv)The kaafir when he becomes a Muslim, because of the report narrated by Abu Dawood (356) which says that the Prophet (peace and blessings of Allaah be upon him) commanded a kaafir man who had become Muslim, “Shave off the hair of kufr and get circumcised.” (Classed as hasan by al-Albaani in Saheeh Abi Dawood; see also al-Mughni, 1/276; Sharh al-‘Umdah by Shaykh al-Islam, 1/350) The scholars (may Allaah have mercy on them) were agreed that it is not recommended to shave the head at times other than these four. See al-Istiqaamah by Shaykh al-Islam, 1/256. 2 – Shirk (the association of others with Allaah). Shaving the head may be a form of shirk, when the head is shaved as an act of humbling oneself before someone other than Allaah. Ibn al-Qayyim (may Allaah have mercy on him) said in Zaad al-Ma’aad (4/195): “Such as when the mureeds (disciples of Sufi shaykhs) shave their heads for their shaykhs, and one of them says, ‘I shaved my head for So and so.’ This is like saying, ‘I prostrated to So and so,’ because shaving the head is an act of humility and submission, which is why it is one of the acts that complete the Hajj, for it means putting one’s forelock in the hand of its Lord, in submission to His greatness and humbling oneself before His glory. It is one of the most eloquent forms of submission. Hence when the Arabs wanted to humiliate their prisoners and free them, they would shave their heads and let them go…” 3 – A reprehensible innovation (bid’ah) – this takes many forms, such as: Shaving the head as an act of worship and religious devotion – other than in the four cases mentioned above – such as making a shaved head a sign of righteousness or complete asceticism (zuhd). This is what the Khawaarij used to do. Hence it was narrated that the Prophet (peace and blessings of Allaah be upon him) described the Khawaarij as “their sign will be that they shave their heads.” (al-Bukhaari, 7007; Muslim, 1763). Al-Qurtubi said: “ ‘Their sign will be that they shave their heads’ means that they will make that a symbol of their rejection of worldly adornments and a sign by which they might be known. This is ignorance on their part… and introducing something into the religion of Allaah which differs from that which the Prophet (peace and blessings of Allaah be upon him), the Rightly-guided Khaleefahs and their followers used to do.” (See Sharh al-‘Umdah, 1/231; Majmoo’ al-Fataawa, 21/118). Another example is that which some people do, ordering a person who has repented to shave his head. This is a bid’ah (innovation) which was not done by any of the Sahaabah or those who followed them in truth, or by any of the imams of the Muslims. (Majmoo’ al-Fataawa, 21/118) 4 – Haraam kinds of shaving the head, which takes a number of forms, such as: (i)Shaving the head when calamity strikes, such as the death of a relative and the like. It was narrated that Abu Moosa al-Ash’ari (may Allaah be pleased with him) said: “The Messenger of Allaah (peace and blessings of Allaah be upon him) disowned the woman who raises her voice in lament, the one who shaves her hair at times of calamity and the one who rends her garment.” Ibn Hajar (may Allaah have mercy on him) mentioned in al-Zawaajir ‘an Iqtiraaf al-Kabaa’ir the 117th major sin: shaving the head at times of calamity. He said: “Because that is showing discontent and a lack of acceptance of the divine decree.” (ii)Shaving the head in a manner that resembles the kuffaar or immoral people who are well known for shaving their heads. A person might do that as a kind of adornment, to make himself look like them, or he might shave the hair at the sides of the head and leave the middle long. All of these are haraam forms of imitating others, and a form of promiscuity and decadence – we ask Allaah to keep us safe and sound. And the Prophet (peace and blessings of Allaah be upon him) said: “Whoever imitates a people is one of them.” (Narrated by Abu Dawood, 4031; classed as saheeh by al-Albaani in Saheeh Abi Dawood, 3401). Al-Faari (may Allaah have mercy on him) said: i.e., whoever makes himself resemble the kuffaar or immoral people, then he is one of them, i.e., he shares the sin with them. 5 – Permissible – i.e., shaving the head for a reason, such as shaving it as a remedy for disease, or to prevent lice and so on. Shaykh al-Islam Ibn Taymiyah (may Allaah have mercy on him) said: This is permissible according to the Qur’aan and Sunnah, and scholarly consensus. (Majmoo’ al-Fataawa, 12/117) 6 – Shaving the head for none of the reasons stated above. This is a matter concerning which the scholars differed. Some of them regarded it as makrooh, such as Maalik (may Allaah have mercy on him), and they quoted as evidence the fact that it is the sign of the followers of innovation, namely the Khawaarij, as stated in the hadeeth quoted above. And the Prophet (peace and blessings of Allaah be upon him) said: “Whoever imitates a people is one of them.” Those who regard it as permissible quoted as evidence the report narrated by Abu Dawood (4192) who said that the Prophet (peace and blessings of Allaah be upon him) came to the family of Ja’far ibn Abi Taalib (may Allaah be pleased with him) three days after Ja’far had died, and called for a barber and told him to shave the heads of his sons. (Classed as saheeh by al-Albaani in Saheeh Abi Dawood, 3532). And Abu Dawood narrated (4195) that the Prophet (peace and blessings of Allaah be upon him) saw a child who had part of his head shaved and not other parts. He said: “Shave it all or leave it all.” (Classed as saheeh by al-Albaani in Saheeh Abi Dawood, 3535). Al-Nawawi (may Allaah have mercy on him) said: “This clearly shows that it is permissible to shave the head, and it cannot be interpreted in any other way.” (Sharh Muslim). But using these two hadeeth to show that it is permissible to shave the head for no reason is a matter which is subject to further discussion. Firstly, shaving the head here is for a reason, so it is permissible, the reason being that boys are more likely than others to be affected by lice, because they sweat a lot and get dirty. Zaad al-Ma’aad, 4/159. Secondly, this has to do with a young boy, and concessions are made for children that are not made for adults. Haashiyat al-Sindi ‘ala al-Nasaa’i. See also Majmoo’ al-Fataawa, 21/119; Sharh al-‘Umdah, 1/230. There is some difference of opinion concerning the fifth type: is shaving the head makrooh or permissible? It is preferable not to shave it. Al-Faawi (may Allaah have mercy on him) said: It is better not to shave it unless that is for Hajj or ‘Umrah, as was the practice of the Prophet (peace and blessings of Allaah be upon him) and his companions (may Allaah be pleased with them). (From ‘Awn al-Ma’bood, 11/248). And Allaah knows best."
Going to the house of the second wife on a day or night that is not hers,Question Is it permissible for the husband to visit his second wife in a day that is not hers (it is for the first wife) just to ask how her health is because she is ill?.,"Praise be to Allah. If the husband goes out of the house of the wife whose day it is and goes to the house of the other wife, that is subject to further discussion: (a) If it is during the day, and the division is on the basis of nights, then it is permissible in case of need, such as dropping things off, handing over money for maintenance, finding out news, and visiting her if she is sick and so on, because of the hadeeth of ‘Aa’ishah (may Allaah be pleased with her) who said: The Messenger of Allaah (peace and blessings of Allaah be upon him) did not favour one of us over another with regard to division of his time and how long he stayed with us, and there was rarely a day when he did not go around to all of us, and he would draw close to each wife without having intercourse, until he reached the one whose day it was, then he would stay overnight with her. Sawdah bint Zam’ah said, when she grew old and feared that the Messenger of Allaah (peace and blessings of Allaah be upon him) would leave her: O Messenger of Allaah, my day is for ‘Aa’ishah; and the Messenger of Allaah (peace and blessings of Allaah be upon him) accepted that from her. Narrated by Abu Dawood (2135); al-Albaani said in Saheeh Abi Dawood: (it is) hasan saheeh. It is permissible for the husband to be intimate with his wife when he enters upon her, without having intercourse, because ‘Aa’ishah (may Allaah be pleased with her) said: The Messenger of Allaah (peace and blessings of Allaah be upon him) would enter upon me when it was the day of another of his wives, and he would do everything with me except intercourse. Classed as hasan by al-Albaani in Irwa’ al-Ghaleel (2023). He should not stay with her for long, and if he stays too long he should make it up to the one whose turn it is. (b) As for going out to the other wife at night, it is not permissible except in case of necessity, such as if she is gravely ill, or giving birth and her contractions are severe, or there is fear of robbery and fire; if he stays with her too long then he should make it up to the one whose turn it is. Ibn Qudaamah (may Allaah have mercy on him) said: As for entering upon her co-wife when it is her turn: If it is at night, it is not permissible except in case of necessity, such as if she is dying, and he wants to be with her or she wants to give him final requests (a will), or something else that is essential. If he does do that, and he does not stay long before he leaves, he does not have to make it up. If he stays and the sick wife recovers, then he should make it up to the other wife, staying as long as he stayed with (the one who sick). If he goes there for something that is not necessary, he is sinning, and the ruling is that he should make it up, just as if he went there for a necessary reason, because there is no point in making up a short time. As for entering upon a wife during the day when it is the turn of another, that is permissible in the case of need, such as giving her maintenance, visiting her if she is sick, asking about something that he needs to know, or visiting her because he has not seen her for a while and so on, because of the report narrated by ‘Aa’ishah who said: The Messenger of Allaah (peace and blessings of Allaah be upon him) would enter upon me when it was the day of another of his wives, and he would do everything with me except intercourse. When he enters upon her, he should not have intercourse with her and he should not stay with her for long, because that means that he has dwelt with her and she is not entitled to that. If he stays too long with her, he should make it up (to the other wife). End quote from al-Mughni (7/234). Based on that, if the husband’s going to the house of the wife whose turn it is not happens by day, for the reason that you mention of checking on her, then there is no sin on him for that, and he should not stay there for a long time, except in case of necessity. If it happens at night, it is not permissible for him to go to her unless it is an emergency, such as if she is very sick or the wife whose turn it is gives him permission. If he stays there for a long time then he must make it up to the other wife, spending as long with her as he did with (the wife whose house he went to out of turn). And Allaah knows best."
