Title,Ques,Ans
Are the compilation of the Qur’aan and the first adhaan for Jumu’ah forms of bid’ah (innovation)?,Question if bidah is wrong· then what about the quran being compiled? and other things such as umar introducing something in the azan? please make this clear as some people say good bidah is allowed· relating it to one of the prophets hadith?,"Praise be to Allah.For a correct definition of bid’ah and guidelines concerning it, please see Questions no. 864, 205, 10843. With regard to what you mention about Abu Bakr compiling the Qur’aan, this is not bid’ah, rather it is Sunnah such as the Prophet (peace and blessings of Allaah be upon him) enjoined us to adhere to when he said: “I urge you to adhere to my Sunnah and the Sunnah of the Rightly-Guided khaleefahs after me.” (Narrated by al-Tirmidhi, 2676; Abu Dawood, 4607; Ibn Maajah, 42. This hadeeth was classed as saheeh by al-Tirmidhi, by al-Haakim, 1/177; and by al-Albaani in Saheeh al-Jaami’, 2549, from the hadeeth of al-‘Irbaad ibn Saariyah). This is one of the Sunnahs of the Rightly-Guided Khaleefah Abu Bakr al-Siddeeq (may Allaah be pleased with him). Bid’ah means seeking to draw close to Allaah by means of acts of worship for which there is no precedent (in sharee’ah). The Qur’aan was compiled in people’s hearts and it was compiled on tablets kept by some of the Sahaabah. Compiling all of it in one place or on one tablet does not involve anything that is to be denounced. Zayd ibn Thaabit said – when Abu Bakr delegated him to collect the Mus-haf – I sought the Qur’aan and I gathered it from pieces, i.e., leaves, patches of leather, shoulder-blades of sheep and camels, leaves of palm trees, and the hearts of men. Al-Qaadi Abu Bakr al-Baaqillaani mentioned the justification for the action of Abu Bakr, the five most important points of which were: 1 – That the Messenger of Allaah (peace and blessings of Allaah be upon him) did not do that for a reason, and Abu Bakr did it because there was a need for it. 2 – Allaah referred in the Qur’aan to al-Suhuf al-Oola (the former Scriptures – al-A’laa 89:19], and He stated that Muhammad (peace and blessings of Allaah be upon him) had something similar in the aayah (interpretation of the meaning]: “reciting (the Qur’aan) purified pages [purified from Al-Baatil (falsehood)]. Wherein are correct and straight laws from Allaah” [al-Bayyinah 98:2-3] So this [action of Abu Bakr] was following that which was prescribed by Allaah and His Messenger. 3 – By doing that, their intention was to fulfil the words of Allaah: “Verily, We, it is We Who have sent down the Dhikr (i.e. the Qur’aan) and surely, We will guard it (from corruption)” [al-Hijr 15:9] It was preserved with Him, and He told us that He would preserve it after it had been sent down. Part of His preserving it was His enabling the Sahaabah to gather it and to agree upon how its spelling and punctuation were to be regulated. 4 – The Prophet (peace and blessings of Allaah be upon him) had scribes to whom he dictated it, so that everyone would understand from this that it should be written down and preserved on sheets. If Allaah’s guarantee to preserve it meant that the ummah would have nothing to do with it, the Messenger of Allaah (peace and blessings of Allaah be upon him) would not have had it written down after Allaah had told him of His guarantee to preserve it. But it is known that the way in which Allaah has preserved it is by causing us to preserve it and making that easy for us, and showing us how it is to be written down. 5 – It is proven that the Prophet (peace and blessings of Allaah be upon him) forbade traveling with the Qur’aan to the land of the enemy. This indicates that it was written down and that the people used to take it with them when they travelled. Abu Bakr ibn al-‘Arabi said: this is the clearest evidence for anyone who studies the issue. See Ahkaam al-Qur’aan, 2/612 With regard to your saying that ‘Umar added “something new” to the adhaan, we know nothing of that. But perhaps you were referring to the fact that ‘Uthmaan added the first call to the Jumu’ah prayers. This is correct, because at the time of the Messenger of Allaah (peace and blessings of Allaah be upon him), there was just one adhaan, but when ‘Uthmaan became khaleefah and Madeenah became larger, ‘Uthmaan thought that the call for Jumu’ah should be given before the time, so the people could get ready for the prayer. This is what is called the first adhaan. It was narrated that al-Saa’ib ibn Yazeed said: At the time of the Prophet (peace and blessings of Allaah be upon him), Abu Bakr and ‘Umar, the first call on Friday used to be when the imaam was sitting on the minbar. But at the time of ‘Uthmaan (may Allaah be pleased with him), when the number of people increased, he added the third call. According to one report, ‘Uthmaan gave orders for the first call. According to another report, the second adhaan was enjoined by ‘Uthmaan. There is no contradiction here, because it is called the third call in the sense that it was something added; the first in the sense that it comes before the adhaan and iqaamah; and the second in the sense that this is an adhaan given in addition to the real adhaan, which was given in al-Zawraa’. Abu ‘Abd-Allaah – i.e., al-Bukhaari – said that al-Zawraa’ was a place in the market of Madeenah. Narrated by al-Bukhaari, 870. This adhaan is not a bid’ah or reprehensible innovation, rather it is one of the Sunnahs of the Rightly-Guided Khaleefah ‘Uthmaan ibn ‘Affaan (may Allaah be pleased with him), which the Prophet (peace and blessings of Allaah be upon him) urged us to adhere to when he said: “I urge you to adhere to my Sunnah and the Sunnah of the Rightly-Guided khaleefahs after me.” Moreover there is a sound reason behind it, which is to alert the people to the fact that the time of prayer is at hand. And it is worth noting that there are no rulings attached to this (first) adhaan, such as the prohibition on buying or selling or the obligation to go to the mosque, and that ‘Uthmaan was wise to have this call made in the marketplace and not in the mosque. This is no more than an alert to the people, to let them know that the time for prayer is at hand, because the houses were far away and far from one another, as mentioned above. Hence it was narrated that ‘Ali (may Allaah be pleased with him) did not do that in Kufa because there was no need for it. And Allaah knows best."
Marrying without her father’s knowledge,"Question I am looking at a lengthy engagement period before my fiance and I am able to financially marry and live together. We would both like to have a nikkah during our engagement so that we are not sinning when we are intimate with each other. However, both of our parents are against this and want us to wait until our marriage reception which is in a year or so. Is it allowed for us to get a nikkah in secret? My second question is, is it ok for us to repeat the nikkah ceremony again during our reception (since our parents won't know of our first nikkah)? Is a double nikkah permissible to the same person? Your help is much appreciated.","Praise be to Allah.You will find a detailed answer to your first question under Question #2127. Know also that you can never have a proper marriage contract without your fathers knowledge and consent. Indeed, he or a person designated by him must marry you to the man who has asked for your hand. Once the marriage contract has been made according to Islamic law, meeting all the required conditions, then there is nothing wrong with having more than one waleemah (wedding reception) in more than one place. And Allaah is the source of help."
Ruling on showing humility to the boss at work,"Question I am a university student, and I want to earn halal wealth, so I can spend on myself and help my family with it as much as I can. The only obstacle to my finding a way of earning a living is my submissive and obsequious attitude towards many people, including my boss at work. My question is: isn’t showing submissiveness to anyone other than Allah a sin? Doesn’t that make wealth earned this way haram? How can I rid myself of this submissiveness and obsequiousness with the boss in particular and with people in general? I don’t mind if you advise me to read a book on this topic, as I love reading.","Praise be to Allah.The basic principle with regard to taking up jobs and occupations is that they are permissible, and nothing is a sin, unless there is clear evidence that it is prohibited. Shaykh al-Islam Ibn Taymiyah (may Allah have mercy on him) said: People’s words and actions are of two types: acts of worship, by means of which they have sound commitment to their religion, and regular daily activities that they need in their worldly affairs. By examining the basic principles of Islam, we realise that the acts of worship which Allah has enjoined or that He loves cannot be proven to be enjoined except on the basis of religious texts… Regular daily activities are permissible in principle, so none of them are to be prohibited except what Allah has prohibited, otherwise we will be included in the verse (interpretation of the meaning): {Say, “Have you seen what Allah has sent down to you of provision of which you have made [some] lawful and [some] unlawful?”} [Yunus 10:59]. Hence Allah condemned the polytheists who prescribed matters of religion for which Allah did not give permission, and they prohibited things that Allah did not prohibit… This is an important and beneficial principle.""(Majmu‘ al-Fatawa 29/16-18). What is causing you confusion as a result of feeling inferior and submissive is because this type of feeling usually occurs as a result of four things when people interact with one another. 1. Humility Humility is prescribed for Muslims in general, and is encouraged in Islamic teachings. Allah, may He be exalted, says (interpretation of the meaning): {O you who have believed, whoever of you should revert from his religion - Allah will bring forth [in place of them] a people He will love and who will love Him [who are] humble toward the believers, powerful against the disbelievers; they strive in the cause of Allah and do not fear the blame of a critic. That is the favor of Allah; He bestows it upon whom He wills. And Allah is all-Encompassing and Knowing} [al-Ma’idah 5:54]. Humility is a kind of mercy and being easy-going when interacting with others, and not looking down on them or being arrogant, as is explained in a different verse, in which Allah, may He be exalted, says (interpretation of the meaning): {Muhammad is the Messenger of Allah ; and those with him are forceful against the disbelievers, merciful among themselves} [al-Fath 48:29]. It was narrated that ‘Abdullah ibn Mas‘ud said: The Messenger of Allah (blessings and peace of Allah be upon him) said: “Shall I not tell you of one who will be forbidden to the Fire, or one to whom the Fire will be forbidden: every approachable, gentle, easy-going person.” Narrated by at-Tirmidhi (2488); he said: This is a hasan gharib hadith. It was classed as sahih by al-Albani in as-Silsilah as-Sahihah (2/611). 2. Fear The worker’s fear of the boss that he may dismiss him from his job or deduct something from his salary is usually a kind of fear of people regarding that in which Allah has granted them power. This is not haram and is not a sin, but it is falling short in putting one’s trust in Allah (tawakkul) in the true meaning of the word. Please see the answer to question no. 191525 . 3. Shyness Shyness (haya’) in dealing with people is part of faith. It was narrated from ‘Abdullah ibn ‘Umar that the Messenger of Allah (blessings and peace of Allah be upon him) passed by a man of the Ansar who was exhorting his brother regarding shyness. The Messenger of Allah (blessings and peace of Allah be upon him) said: “Let him be, for shyness is part of faith.” Narrated by al-Bukhari (24) and Muslim (36). An-Nawawi (may Allah have mercy on him) said: What is meant by “exhorting his brother regarding shyness” is that he was telling him not to be shy, and telling him that shyness was bad and rebuking him for being too shy. The Prophet (blessings and peace of Allah be upon him) told him not to do that, and said: “Let him be, for shyness is part of faith” – in other words, let him be shy and stop telling him not to be like that.""(Sharh Sahih Muslim 2/6). 4. Obedience Obedience to your boss regarding what you committed yourself to do in the contract between you and him is something obligatory. Allah, may He be exalted, says (interpretation of the meaning): {O you who have believed, fulfill [all] contracts} [al-Ma’idah 5:1]. With regard to obeying your boss when he asks you to do something that is in the interests of the work, but is not included in the contract, if it is minor and does not harm the worker, then doing that is recommended. It was narrated from Jaabir ibn ‘Abdillah (may Allah be pleased with them both) that the Messenger of Allah (blessings and peace of Allah be upon him) said: “May Allah have mercy on a man who is easy-going when he sells, when he buys, and when he asks for payment.” Narrated by al-Bukhari (2076). Al-Hafiz Ibn Hajar (may Allah have mercy on him) said: This is encouragement to be easy-going when dealing with people, and to be well mannered, with a sublime attitude, and not to be strict.""(Fath al-Bari 4/307). To sum up: if the Muslim interacts with his boss or with other people in these ways, he will be fine or will be rewarded. But that is subject to the condition that good manners and a good attitude when dealing with people does not lead to keeping quiet about or approving of haram actions, or helping others in doing them, or doing them oneself. Allah, may He be exalted, says (interpretation of the meaning): {And cooperate in righteousness and piety, but do not cooperate in sin and transgression. And fear Allah; indeed, Allah is severe in penalty} [al-Ma’idah 5:2]. There can be no humility, shyness or obedience when it comes to haram matters. It was narrated from ‘Ali (may Allah be pleased with him) that the Prophet (blessings and peace of Allah be upon him) said: “There is no obedience if it involves disobedience [to Allah]; rather obedience is only in that which is right and proper.” Narrated by al-Bukhari (7257) and Muslim (1840). It was also narrated by Imam Ahmad in al-Musnad (2/318) as: “There is no obedience to any human if it involves disobedience to Allah.” Just being afraid of your boss at work is not an excuse for committing haram actions. Rather what you must do if you see haram actions being committed is to denounce them to the best of your ability and as much as will achieve the goal of removing them, in compliance with the words of the Prophet (blessings and peace of Allah be upon him): “Whoever among you sees an evil action, let him change it with his hand (by taking action); if he cannot, then with his tongue (by speaking out); and if he cannot, then with his heart (by hating it and feeling it is wrong), and that is the weakest of faith.” Narrated by Muslim (49). You should also be cautious and ensure that your good attitude in dealing with people does not lead to you allowing others to humiliate you, for it is not the way of the believer to put himself in a humiliating position. Ibrahim an-Nakha‘i said: They – meaning the early generations (salaf) – hated to be humiliated by others, but when they had the power to retaliate, they would forgive. Mentioned in a mu‘allaq report by al-Bukhari in as-Sahih. Fath al-Bari (5/99). Conclusion: if you are doing permissible work, and not helping in any sin or approving of it, and not putting yourself in a humiliating position, then there is nothing wrong with your work. Your feelings of being inferior or submissive to the boss may be intrusive thoughts from the Shaytan, aimed at discouraging you from doing that which is beneficial for you. The way to deal with that is to seek Allah’s help and focus on what you find beneficial in your permissible work. It was narrated that Abu Hurayrah said: The Messenger of Allah (blessings and peace of Allah be upon him) said: “The strong believer is better and more beloved to Allah than the weak believer, although both are good. Strive to do that which will benefit you and seek the help of Allah, and do not feel helpless.” Narrated by Muslim (2664). If your issue has to do with extreme shyness, we advise you to read the book Fiqh al-Haya’ by Shaykh Muhammad Isma‘il al-Muqaddam. And Allah knows best."
Dealing With Homosexual Brother-In-Law,"Question I have a daughter who is three years old, and two sons, one of whom is nine and the other is two. These days I am having some problems with my husband because he suggested that he should bring his brother, who is homosexual and is fifty years old, to stay with us! I adamantly refused to agree to that. I do not want any homosexual man to enter my house. I am afraid that he will bring some punishment or wrath from Allah upon us. I also fear for my nine-year-old son lest he be influenced by this man in some way. My husband also wanted me to show respect to his brother and to speak kindly to him, and so on. How can he expect all this from me towards a man like that?! Do you have any advice? I hope that you can help me to resolve this problem.","Praise be to Allah. If it is proven that your brother’s husband is as you describe him and that he is a homosexual and does the action of the people of Loot, then it is not permissible – in this case – for your husband to admit him to his house, let alone allow him to meet his sons. It is also not permissible for him to ask you to show respect to him, because he is not one of those who are deserving of respect; rather he is one of those who are deserving of rebuke and shunning, and he deserves to be shown hostility because of what he is, not to be respected, because what he is doing is a grave evil, immorality, and act of disobedience. The major sin that he is doing – if it is proven – is one of the most horrid and repulsive of major sins. Hence those who do it are deserving of the greatest punishment such as landslides, stoning and drowning such as no nation of disbelievers were punished with before or since. Ibn al-Qayyim narrated – in Zaad al-Ma‘aad (5/40) – from his shaykh, Ibn Taymiyah (may Allah have mercy on him), that the Sahaabah (companions of the Prophet) were unanimously agreed that the one who does the action of the people of Loot is to be executed; they only differed as to the manner of execution. Regarding the serious nature of the sin of homosexuality and the punishment for the one who does it, please see the answer to questions no. 38622, 2104 and 10050 Hence we agree with you in your stance about him entering your house, and we also agree with you about the kind of treatment that he deserves. So do not hesitate to prevent him from entering the house in the first place, let alone staying there. What your husband has to do is to take the decision himself; rather he should have taken a decision before you did, because Islam has given him the responsibility of taking care of his family, looking after them and advising them. His giving permission to his homosexual brother to enter his house and meet his sons, and asking his wife to show respect to him – all of that is contrary to the obligations that Allah has given him of protecting his family and taking care of them. It is a kind of haraam (unlawful) betrayal of his flock for whom Allah has made him responsible. But if it so happens that this homosexual has repented sincerely before he enters your house or stays there, and he shows you that he has truly repented and mended his ways, then in that case there is nothing wrong with him entering the house, provided that the wife does not appear before him or mix with him or spend time alone with him; these actions are basically forbidden even if the person is pious. He is still the “in-law” whom Islam warns about. We have explained in more than one answer the seriousness of this problem, how widespread it is and how people are heedless concerning it. So in the case of a person like this, it is essential to deal with him, even after his repentance, with the greatest caution and to block all ways that may lead to evil and temptation. See the answers to questions no. 7650, 129302, 13261 and 47764 Let your husband also read the answer to question no. 147901 in which there is discussion of what the brother’s responsibilities are towards his homosexual brother. And Allah knows best."
